{
  "$schema": "http://json-schema.org/draft-07/schema#",
  "title": "Vanguard Meridian Statement Input",
  "type": "object",
  "properties": {
    "company": { "type": "string" },
    "period": { "type": "string" },
    "kpis": { "type": "array" },
    "allocation": { "type": "array" },
    "holdings": { "type": "array" }
  },
  "required": ["company", "period"]
}